model;language;attempt;tokens;start_time;end_time;number_of_builds_test_runs_needed;description
opus46high;csharp;1;31.600;2026-04-26 13:18:34.272;2026-04-26 13:20:33.568;4;Smooth implementation - added Zombie enum value, updated neighbor counting and evolution logic
opus46high;csharp;2;31.300;2026-04-26 13:18:43.027;2026-04-26 13:20:49.704;3;Straightforward implementation — added Zombie enum value, updated neighbor counting and evolution rules, but needed 2 extra test runs to fix incorrect hand-calculated expected values in zombie test grids
opus46high;csharp;3;34.700;2026-04-26 13:18:52.490;2026-04-26 13:21:14.737;3;Implementation was straightforward (enum + pattern match + neighbor counting) but required 2 extra runs to fix incorrect expected values in test grids due to miscounting zombie neighbor effects
opus46high;csharp;4;31.700;2026-04-26 13:18:59.361;2026-04-26 13:20:54.933;2;First run failed due to incorrect test expectations in 3 zombie tests (miscalculated neighbor effects on non-zombie cells), fixed expectations and passed on second run
opus46high;csharp;5;36.000;2026-04-26 13:19:11.038;2026-04-26 13:21:28.828;3;Clean run — implementation was correct on first try but had to fix 3 test expectations where zombie-as-live neighbor effects on surrounding cells were miscalculated
opus46high;fsharp;1;38.800;2026-04-26 14:01:05.713;2026-04-26 14:04:27.534;3;Smooth implementation - added Zombie DU case and 3 logic changes, but had to fix 5 test expectations in a second run due to miscalculated neighbor counts for zombie cells
opus46high;fsharp;2;33.200;2026-04-26 14:01:07.851;2026-04-26 14:03:52.539;2;Clean run - added Zombie DU case, updated neighbor counting and evolveCell, first test run had wrong expected values in tests due to miscalculated neighbor interactions, fixed expectations and all 15 tests passed
opus46high;fsharp;3;33.300;2026-04-26 14:01:22.294;2026-04-26 14:03:32.598;2;First run had 2 test failures due to manually miscalculated expected values for zombie neighbor interaction tests
opus46high;fsharp;4;31.800;2026-04-26 14:01:29.017;2026-04-26 14:03:45.080;2;Smooth implementation — added Zombie DU case, counted zombies as live neighbors, and made zombies immutable in evolveCell
opus46high;fsharp;5;37.300;2026-04-26 14:01:38.175;2026-04-26 14:04:36.436;3;Implementation was straightforward but 4 test expectations had incorrect expected grids due to miscounting zombie neighbor effects - needed 2 extra test runs to fix expected outputs
opus47;fsharp;1;32.400;2026-04-26 12:19:38.938;2026-04-26 12:20:42.233;1;Straightforward addition of Zombie cell variant
opus47;fsharp;2;39.300;2026-04-26 12:19:49.971;2026-04-26 12:21:43.071;3;Implemented Zombie cell variant straightforwardly
opus47;fsharp;3;37.800;2026-04-26 12:20:00.736;2026-04-26 12:21:21.519;3;Two early build failures from mangled string replacements (overlapping context lines clobbered the Cell type and a duplicated `[<Fact>]` block) but logic was correct on the first try and passed all 15 tests once the syntax was repaired.
sonnet46high;fsharp;1;35.000;2026-04-26 12:29:37.619;2026-04-26 12:32:07.198;2;Implementation was straightforward but initial test expected values were miscalculated — the surrounding cells' evolution was overlooked when zombie neighbors affect them, requiring a second test run after correcting expectations.
sonnet46high;fsharp;2;34.600;2026-04-26 12:29:35.459;2026-04-26 12:32:13.761;2;Implementation was straightforward (add Zombie DU case, count zombies as live in neighbor count, short-circuit zombie evolution), but the first test run revealed the test expected values were wrong due to miscalculating how zombie neighbors affect other cells' evolution.
sonnet46high;fsharp;3;35.100;2026-04-26 12:29:56.421;2026-04-26 12:32:15.910;2;Implementation was straightforward but required a second test run after fixing four incorrectly calculated expected grids in the zombie tests.
opus46high;js;1;29.400;2026-04-26 12:56:19.271;2026-04-26 12:57:19.180;2;Clean run — added zombie cell state as 'Z' string, updated neighbor counting to treat Z as live, skipped state transitions for zombies. All tests passed on first implementation attempt.
opus46high;js;2;32.100;2026-04-26 12:56:21.215;2026-04-26 12:58:25.965;3;Clean run - implementation was correct on first try but had to fix 4 test expectations where zombie neighbor effects on surrounding cells were miscalculated
opus46high;js;3;26.500;2026-04-26 12:56:31.747;2026-04-26 12:57:30.193;1;Clean run with no issues - added zombie cell state as string 'Z' that counts as live for neighbors but never changes its own state, all 15 tests passed on first run
opus46high;js;4;26.000;2026-04-26 13:14:38.586;2026-04-26 13:15:43.839;3;Clean run with no surprises - added zombie cell state as string 'Z' that counts as live for neighbors but never changes, all 15 tests passed on first implementation attempt
opus46high;js;5;28.900;2026-04-26 13:14:50.483;2026-04-26 13:15:46.486;1;Clean run with no surprises - added zombie cell state as string 'Z' that counts as live for neighbors but never changes its own state, all 15 tests passed on first attempt
opus46high;python;1;38.200;2026-04-26 13:25:39.191;2026-04-26 13:28:19.492;3;"Smooth run - implementation was correct on first try but test expectations needed fixing because zombie cells must persist as ""Z"" in output rather than becoming 0"
opus46high;python;2;35.900;2026-04-26 13:25:52.515;2026-04-26 13:28:11.606;2;Smooth run - initial test expectations for zombie cells had errors (forgot zombies persist in output and miscounted some neighbor effects), fixed in second iteration and all 15 tests passed
opus46high;python;3;37.900;2026-04-26 13:25:53.316;2026-04-26 13:28:07.388;2;First run failed due to incorrect expected values in zombie tests (forgot zombies persist in output and dead cells become 1 not Z), fixed all 5 test expectations and passed on second run
opus46high;python;4;36.600;2026-04-26 13:26:03.713;2026-04-26 13:28:03.149;3;Smooth implementation but had to fix 3 test expectations where zombie neighbor effects on surrounding cells were miscalculated
opus46high;python;5;37.300;2026-04-26 13:26:11.559;2026-04-26 13:28:39.097;3;Smooth implementation but needed 2 extra iterations to fix incorrect expected values in zombie tests where zombies were wrongly expected to become 0 in output and neighbor counts were miscalculated
opus46high;ts;1;27.900;2026-04-26 13:51:42.405;2026-04-26 13:53:27.048;2;Smooth run with only one failing iteration (missing Zombie enum member) before going green - no surprises
opus46high;ts;2;25.700;2026-04-26 13:51:49.117;2026-04-26 13:53:00.382;1;Clean first-pass implementation — added Zombie enum value, skip zombies in tick, count zombies as live neighbors, all 15 tests green on first run
opus46high;ts;3;25.900;2026-04-26 13:51:57.538;2026-04-26 13:53:06.009;1;Clean run - added Zombie enum value, updated tick to skip zombies and countLiveNeighbors to count them as live, all 15 tests passed on first run
opus46high;ts;4;27.200;2026-04-26 13:52:04.790;2026-04-26 13:53:29.402;2;Smooth run — added Zombie enum value, updated tick to skip zombies and count them as live neighbors, all tests green on first implementation build
opus46high;ts;5;27.400;2026-04-26 13:52:11.313;2026-04-26 13:53:35.826;2;Clean run with no surprises - added Zombie enum value, updated tick to skip zombies and countLiveNeighbors to count them as live, all 15 tests green on first try after changes
